{"attempt":1,"baseline_evaluation_payload":{"external_schema":{"id":"urn:atlasrepo:atlas-research:fixture:v1:linear-evaluator","version":"1.0.0"},"media_type":"application/json","producer":{"name":"atlas-research","version":"0.1.0"},"role":"evaluation_payload","sha256":"91d0a4decc8caee12120d7a15a8ce17558f9aebf9b29849a68c1b21453aaa7b1","size_bytes":103,"uri":"baseline.json"},"benchmark_manifest":{"external_schema":{"id":"urn:atlasrepo:atlas-research:schema:v1:benchmark-manifest","version":"1.0.0"},"media_type":"application/vnd.atlas-research.benchmark-manifest+json","producer":{"name":"atlas-research","version":"0.1.0"},"role":"benchmark_manifest","sha256":"7bd7670ef412fcbd5cd920466a3882c5c59af2445874db1f8002e7c9aa5529e6","size_bytes":1385,"uri":"benchmark.json"},"candidate":{"external_schema":{"id":"urn:atlasrepo:atlas-research:schema:v1:candidate-artifact","version":"1.0.0"},"media_type":"application/vnd.atlas-research.candidate+json","producer":{"name":"atlas-research","version":"0.1.0"},"role":"candidate","sha256":"c81a44a261baec7a174be51d1573c1421962fcb44fbd40533232bae19acb5da0","size_bytes":1142,"uri":"candidate.json"},"created_at":"2026-08-29T00:00:00Z","dataset_manifest":{"external_schema":{"id":"urn:atlasrepo:atlas-research:schema:v1:dataset-manifest","version":"1.0.0"},"media_type":"application/vnd.atlas-research.dataset-manifest+json","producer":{"name":"atlas-research","version":"0.1.0"},"role":"dataset_manifest","sha256":"1eb842328e9199674c6838b13a9e3aeb8b01392da8aa43c4ff67c116e909cbb4","size_bytes":1813,"uri":"dataset.json"},"deadline":"2099-01-01T00:00:00Z","evaluation_split":"validation","idempotency_key":"atlas-research-fixture-v1","job_id":"atlas-research-fixture-v1-job","limits":{"max_input_bytes":1048576,"max_json_depth":16,"max_open_files":64,"max_output_bytes":1048576,"max_peak_rss_bytes":1073741824,"max_records":100,"max_string_bytes":4096,"max_workspace_bytes":1048576,"wall_seconds":30},"schema_version":"1.0.0","task":"research.experiment"}
